==31761== Memcheck, a memory error detector
==31761== Copyright (C) 2002-2022, and GNU GPL'd, by Julian Seward et al.
==31761== Using Valgrind-3.22.0 and LibVEX; rerun with -h for copyright info
==31761== Command: ./bin/execute_script script20
==31761== 
==31761== Invalid read of size 4
==31761==    at 0x1096D3: mult_mats_sf (hw7.c:88)
==31761==    by 0x10A06A: evaluate_expr_sf (hw7.c:324)
==31761==    by 0x10A38A: execute_script_sf (hw7.c:391)
==31761==    by 0x1093EE: main (execute_script.c:8)
==31761==  Address 0x4 is not stack'd, malloc'd or (recently) free'd
==31761== 
==31761== 
==31761== Process terminating with default action of signal 11 (SIGSEGV)
==31761==  Access not within mapped region at address 0x4
==31761==    at 0x1096D3: mult_mats_sf (hw7.c:88)
==31761==    by 0x10A06A: evaluate_expr_sf (hw7.c:324)
==31761==    by 0x10A38A: execute_script_sf (hw7.c:391)
==31761==    by 0x1093EE: main (execute_script.c:8)
==31761==  If you believe this happened as a result of a stack
==31761==  overflow in your program's main thread (unlikely but
==31761==  possible), you can try to increase the size of the
==31761==  main thread stack using the --main-stacksize= flag.
==31761==  The main thread stack size used in this run was 8388608.
==31761== 
==31761== HEAP SUMMARY:
==31761==     in use at exit: 5,158 bytes in 9 blocks
==31761==   total heap usage: 11 allocs, 2 frees, 5,284 bytes allocated
==31761== 
==31761== 6 bytes in 1 blocks are still reachable in loss record 1 of 8
==31761==    at 0x4846828: malloc (in /usr/libexec/valgrind/vgpreload_memcheck-amd64-linux.so)
==31761==    by 0x109A83: infix2postfix_sf (hw7.c:178)
==31761==    by 0x109E39: evaluate_expr_sf (hw7.c:284)
==31761==    by 0x10A38A: execute_script_sf (hw7.c:391)
==31761==    by 0x1093EE: main (execute_script.c:8)
==31761== 
==31761== 24 bytes in 1 blocks are still reachable in loss record 2 of 8
==31761==    at 0x4846828: malloc (in /usr/libexec/valgrind/vgpreload_memcheck-amd64-linux.so)
==31761==    by 0x109462: insert_bst_sf (hw7.c:6)
==31761==    by 0x10A366: execute_script_sf (hw7.c:388)
==31761==    by 0x1093EE: main (execute_script.c:8)
==31761== 
==31761== 24 bytes in 1 blocks are still reachable in loss record 3 of 8
==31761==    at 0x4846828: malloc (in /usr/libexec/valgrind/vgpreload_memcheck-amd64-linux.so)
==31761==    by 0x10949C: insert_bst_sf (hw7.c:12)
==31761==    by 0x10A366: execute_script_sf (hw7.c:388)
==31761==    by 0x1093EE: main (execute_script.c:8)
==31761== 
==31761== 32 bytes in 1 blocks are still reachable in loss record 4 of 8
==31761==    at 0x4846828: malloc (in /usr/libexec/valgrind/vgpreload_memcheck-amd64-linux.so)
==31761==    by 0x109E59: evaluate_expr_sf (hw7.c:285)
==31761==    by 0x10A38A: execute_script_sf (hw7.c:391)
==31761==    by 0x1093EE: main (execute_script.c:8)
==31761== 
==31761== 240 bytes in 1 blocks are still reachable in loss record 5 of 8
==31761==    at 0x484DB80: realloc (in /usr/libexec/valgrind/vgpreload_memcheck-amd64-linux.so)
==31761==    by 0x48EFC51: getdelim (iogetdelim.c:107)
==31761==    by 0x10A3C4: execute_script_sf (hw7.c:370)
==31761==    by 0x1093EE: main (execute_script.c:8)
==31761== 
==31761== 264 bytes in 2 blocks are still reachable in loss record 6 of 8
==31761==    at 0x4846828: malloc (in /usr/libexec/valgrind/vgpreload_memcheck-amd64-linux.so)
==31761==    by 0x10996E: create_matrix_sf (hw7.c:148)
==31761==    by 0x10A34F: execute_script_sf (hw7.c:387)
==31761==    by 0x1093EE: main (execute_script.c:8)
==31761== 
==31761== 472 bytes in 1 blocks are still reachable in loss record 7 of 8
==31761==    at 0x4846828: malloc (in /usr/libexec/valgrind/vgpreload_memcheck-amd64-linux.so)
==31761==    by 0x48EEE7E: __fopen_internal (iofopen.c:65)
==31761==    by 0x48EEE7E: fopen@@GLIBC_2.2.5 (iofopen.c:86)
==31761==    by 0x10A23E: execute_script_sf (hw7.c:364)
==31761==    by 0x1093EE: main (execute_script.c:8)
==31761== 
==31761== 4,096 bytes in 1 blocks are still reachable in loss record 8 of 8
==31761==    at 0x4846828: malloc (in /usr/libexec/valgrind/vgpreload_memcheck-amd64-linux.so)
==31761==    by 0x48EE1B4: _IO_file_doallocate (filedoalloc.c:101)
==31761==    by 0x48FE523: _IO_doallocbuf (genops.c:347)
==31761==    by 0x48FB883: _IO_file_underflow@@GLIBC_2.2.5 (fileops.c:486)
==31761==    by 0x48EFE0F: getdelim (iogetdelim.c:77)
==31761==    by 0x10A3C4: execute_script_sf (hw7.c:370)
==31761==    by 0x1093EE: main (execute_script.c:8)
==31761== 
==31761== LEAK SUMMARY:
==31761==    definitely lost: 0 bytes in 0 blocks
==31761==    indirectly lost: 0 bytes in 0 blocks
==31761==      possibly lost: 0 bytes in 0 blocks
==31761==    still reachable: 5,158 bytes in 9 blocks
==31761==         suppressed: 0 bytes in 0 blocks
==31761== 
==31761== ERROR SUMMARY: 1 errors from 1 contexts (suppressed: 0 from 0)
==31761== 
==31761== 1 errors in context 1 of 1:
==31761== Invalid read of size 4
==31761==    at 0x1096D3: mult_mats_sf (hw7.c:88)
==31761==    by 0x10A06A: evaluate_expr_sf (hw7.c:324)
==31761==    by 0x10A38A: execute_script_sf (hw7.c:391)
==31761==    by 0x1093EE: main (execute_script.c:8)
==31761==  Address 0x4 is not stack'd, malloc'd or (recently) free'd
==31761== 
==31761== ERROR SUMMARY: 1 errors from 1 contexts (suppressed: 0 from 0)
Segmentation fault (core dumped)
