==31581== Memcheck, a memory error detector
==31581== Copyright (C) 2002-2022, and GNU GPL'd, by Julian Seward et al.
==31581== Using Valgrind-3.22.0 and LibVEX; rerun with -h for copyright info
==31581== Command: ./bin/execute_script script02
==31581== 
==31581== Invalid read of size 4
==31581==    at 0x109628: add_mats_sf (hw7.c:72)
==31581==    by 0x109FB2: evaluate_expr_sf (hw7.c:310)
==31581==    by 0x10A38A: execute_script_sf (hw7.c:391)
==31581==    by 0x1093EE: main (execute_script.c:8)
==31581==  Address 0x4 is not stack'd, malloc'd or (recently) free'd
==31581== 
==31581== 
==31581== Process terminating with default action of signal 11 (SIGSEGV)
==31581==  Access not within mapped region at address 0x4
==31581==    at 0x109628: add_mats_sf (hw7.c:72)
==31581==    by 0x109FB2: evaluate_expr_sf (hw7.c:310)
==31581==    by 0x10A38A: execute_script_sf (hw7.c:391)
==31581==    by 0x1093EE: main (execute_script.c:8)
==31581==  If you believe this happened as a result of a stack
==31581==  overflow in your program's main thread (unlikely but
==31581==  possible), you can try to increase the size of the
==31581==  main thread stack using the --main-stacksize= flag.
==31581==  The main thread stack size used in this run was 8388608.
==31581== 
==31581== HEAP SUMMARY:
==31581==     in use at exit: 4,848 bytes in 9 blocks
==31581==   total heap usage: 10 allocs, 1 frees, 4,856 bytes allocated
==31581== 
==31581== 8 bytes in 1 blocks are still reachable in loss record 1 of 8
==31581==    at 0x4846828: malloc (in /usr/libexec/valgrind/vgpreload_memcheck-amd64-linux.so)
==31581==    by 0x109A83: infix2postfix_sf (hw7.c:178)
==31581==    by 0x109E39: evaluate_expr_sf (hw7.c:284)
==31581==    by 0x10A38A: execute_script_sf (hw7.c:391)
==31581==    by 0x1093EE: main (execute_script.c:8)
==31581== 
==31581== 24 bytes in 1 blocks are still reachable in loss record 2 of 8
==31581==    at 0x4846828: malloc (in /usr/libexec/valgrind/vgpreload_memcheck-amd64-linux.so)
==31581==    by 0x109462: insert_bst_sf (hw7.c:6)
==31581==    by 0x10A366: execute_script_sf (hw7.c:388)
==31581==    by 0x1093EE: main (execute_script.c:8)
==31581== 
==31581== 24 bytes in 1 blocks are still reachable in loss record 3 of 8
==31581==    at 0x4846828: malloc (in /usr/libexec/valgrind/vgpreload_memcheck-amd64-linux.so)
==31581==    by 0x10949C: insert_bst_sf (hw7.c:12)
==31581==    by 0x10A366: execute_script_sf (hw7.c:388)
==31581==    by 0x1093EE: main (execute_script.c:8)
==31581== 
==31581== 32 bytes in 1 blocks are still reachable in loss record 4 of 8
==31581==    at 0x4846828: malloc (in /usr/libexec/valgrind/vgpreload_memcheck-amd64-linux.so)
==31581==    by 0x109E59: evaluate_expr_sf (hw7.c:285)
==31581==    by 0x10A38A: execute_script_sf (hw7.c:391)
==31581==    by 0x1093EE: main (execute_script.c:8)
==31581== 
==31581== 72 bytes in 2 blocks are still reachable in loss record 5 of 8
==31581==    at 0x4846828: malloc (in /usr/libexec/valgrind/vgpreload_memcheck-amd64-linux.so)
==31581==    by 0x10996E: create_matrix_sf (hw7.c:148)
==31581==    by 0x10A34F: execute_script_sf (hw7.c:387)
==31581==    by 0x1093EE: main (execute_script.c:8)
==31581== 
==31581== 120 bytes in 1 blocks are still reachable in loss record 6 of 8
==31581==    at 0x4846828: malloc (in /usr/libexec/valgrind/vgpreload_memcheck-amd64-linux.so)
==31581==    by 0x48EFD84: getdelim (iogetdelim.c:65)
==31581==    by 0x10A3C4: execute_script_sf (hw7.c:370)
==31581==    by 0x1093EE: main (execute_script.c:8)
==31581== 
==31581== 472 bytes in 1 blocks are still reachable in loss record 7 of 8
==31581==    at 0x4846828: malloc (in /usr/libexec/valgrind/vgpreload_memcheck-amd64-linux.so)
==31581==    by 0x48EEE7E: __fopen_internal (iofopen.c:65)
==31581==    by 0x48EEE7E: fopen@@GLIBC_2.2.5 (iofopen.c:86)
==31581==    by 0x10A23E: execute_script_sf (hw7.c:364)
==31581==    by 0x1093EE: main (execute_script.c:8)
==31581== 
==31581== 4,096 bytes in 1 blocks are still reachable in loss record 8 of 8
==31581==    at 0x4846828: malloc (in /usr/libexec/valgrind/vgpreload_memcheck-amd64-linux.so)
==31581==    by 0x48EE1B4: _IO_file_doallocate (filedoalloc.c:101)
==31581==    by 0x48FE523: _IO_doallocbuf (genops.c:347)
==31581==    by 0x48FB883: _IO_file_underflow@@GLIBC_2.2.5 (fileops.c:486)
==31581==    by 0x48EFE0F: getdelim (iogetdelim.c:77)
==31581==    by 0x10A3C4: execute_script_sf (hw7.c:370)
==31581==    by 0x1093EE: main (execute_script.c:8)
==31581== 
==31581== LEAK SUMMARY:
==31581==    definitely lost: 0 bytes in 0 blocks
==31581==    indirectly lost: 0 bytes in 0 blocks
==31581==      possibly lost: 0 bytes in 0 blocks
==31581==    still reachable: 4,848 bytes in 9 blocks
==31581==         suppressed: 0 bytes in 0 blocks
==31581== 
==31581== ERROR SUMMARY: 1 errors from 1 contexts (suppressed: 0 from 0)
==31581== 
==31581== 1 errors in context 1 of 1:
==31581== Invalid read of size 4
==31581==    at 0x109628: add_mats_sf (hw7.c:72)
==31581==    by 0x109FB2: evaluate_expr_sf (hw7.c:310)
==31581==    by 0x10A38A: execute_script_sf (hw7.c:391)
==31581==    by 0x1093EE: main (execute_script.c:8)
==31581==  Address 0x4 is not stack'd, malloc'd or (recently) free'd
==31581== 
==31581== ERROR SUMMARY: 1 errors from 1 contexts (suppressed: 0 from 0)
Segmentation fault (core dumped)
